Job Title,Company,Location,Work Type,Salary,Link
Supervisor IPAL,Sinergi 7 Utama,"Gedebage, Bandung, Jawa Barat, Indonesia",Kontrak,"Rp3,5jt-Rp4,5jt",https://glints.com/id/opportunities/jobs/supervisor-ipal/67af5e10-547c-4f16-97d6-28e400f49d1e?utm_referrer=explore
HOST LIVE STREAMING MARKETPLACE,CutOff - Life Daily Wear,"Lakarsantri, Surabaya, Jawa Timur, Indonesia",Kurang dari setahun,"Rp1,9jt-Rp2,1jt",https://glints.com/id/opportunities/jobs/host-live-streaming-marketplace/dc122b6e-0377-412d-8cc8-84b5604ff0f5?utm_referrer=explore
Desainer Grafis Sosmed,Bikinidcard,"Kapanewon Sewon, Bantul, DI Yogyakarta, Indonesia",Minimal Sarjana (S1),"Rp1,7jt-Rp4,5jt",https://glints.com/id/opportunities/jobs/desainer-grafis-sosmed/dabc1caf-83f2-4c50-abf6-7d80138c26c2?utm_referrer=explore
Beautician (Staff Eyelash/ Nail Art),Lush And Glow,"Kebayoran Lama, Jakarta Selatan, DKI Jakarta, Indonesia",Problem Management,"Rp4,5jt-Rp9jt",https://glints.com/id/opportunities/jobs/beautician-staff-eyelash-nail-art/7688533c-3f83-475d-bf97-ddf4f322c0ed?utm_referrer=explore
Catering Service Manager,Alcor Prime,"Tebet, Jakarta Selatan, DKI Jakarta, Indonesia",+4,Rp6jt-Rp8jt,https://glints.com/id/opportunities/jobs/catering-service-manager/2c6e9f58-b485-4b88-b8fa-eb84f43de47d?utm_referrer=explore
Software Developer Full Stack Odoo - Yogyakarta,Flexypack,"Kapanewon Banguntapan, Bantul, DI Yogyakarta, Indonesia",Penuh Waktu,Rp9jt-Rp12jt,https://glints.com/id/opportunities/jobs/software-developer-full-stack-odoo-yogyakarta/fbbfbc77-90ca-4105-88e1-06816d5e7fc6?utm_referrer=explore
Chef de Partie (Hot Kitchen),Alcor Prime,"Tebet, Jakarta Selatan, DKI Jakarta, Indonesia",Kurang dari setahun,Rp3jt-Rp6jt,https://glints.com/id/opportunities/jobs/chef-de-partie-hot-kitchen/c9a0873f-3236-4fa8-aeb8-21cebdcfd0d7?utm_referrer=explore
Sales Canvasser,PT Sanjaya Garmen Aksesoris,"Tambora, Jakarta Barat, DKI Jakarta, Indonesia",Minimal Diploma (D1 - D4),"Rp2,5jt-Rp6jt",https://glints.com/id/opportunities/jobs/sales-canvasser/cb58fe51-5e83-42ce-838f-084f0f770f6b?utm_referrer=explore
Kepala Teknisi/Mekanik Truck Trailer,HARIBIMA TRANS INTERNASIONAL,"Batam Kota, Batam, Kepulauan Riau, Indonesia",Host Live Steam,"Rp1,5jt-Rp2,5jt",https://glints.com/id/opportunities/jobs/kepala-teknisi-mekanik-truck-trailer/bab81cde-dc07-4055-a573-5a2c509a766d?utm_referrer=explore
Supervisor Toko,Fin Elektronik,"Kapanewon Pleret, Bantul, DI Yogyakarta, Indonesia",+6,N/A,https://glints.com/id/opportunities/jobs/supervisor-toko/87bfddd2-1e49-4d81-9071-40dbec7aa97b?utm_referrer=explore
Photographer,Howel And Co,"Tambora, Jakarta Barat, DKI Jakarta, Indonesia",Penuh Waktu,N/A,https://glints.com/id/opportunities/jobs/photographer/01a17147-d36f-4b76-8bcf-494451dc3fba?utm_referrer=explore
Senior Golang Engineer,PT Starvo Global Energi,"Penjaringan, Jakarta Utara, DKI Jakarta, Indonesia",Kurang dari setahun,N/A,https://glints.com/id/opportunities/jobs/senior-golang-engineer/13b048bd-7232-4b50-87fa-3a05af68bf74?utm_referrer=explore
Content Creator,Howel And Co,"Tambora, Jakarta Barat, DKI Jakarta, Indonesia",Minimal SMA/SMK,N/A,https://glints.com/id/opportunities/jobs/content-creator/7c80e974-4ce2-4b36-84cc-df68d93e0356?utm_referrer=explore
Sales Marketing,PT. Estetika Ruang Indah,"Sungai Pinang, Samarinda, Kalimantan Timur, Indonesia",Pengalaman Buat Konten,N/A,https://glints.com/id/opportunities/jobs/sales-marketing/e31e63c7-de72-435a-8514-99296d16f1a0?utm_referrer=explore
Sales Corporate Staff,PT Bravo Persada Nusantara (Bravo Wisata),"Tangerang, Tangerang, Banten, Indonesia",+2,N/A,https://glints.com/id/opportunities/jobs/sales-corporate-staff/aed67c29-fc9f-4770-b394-c25f452b3c45?utm_referrer=explore
Senior Tax Planner & Manager,Patris Official,"Bogor Timur, Bogor, Jawa Barat, Indonesia",Penuh Waktu,N/A,https://glints.com/id/opportunities/jobs/senior-tax-planner-and-manager/61865ecc-7801-45fe-8e48-ca0e2ed48295?utm_referrer=explore
STAFF PAJAK,DM GROUP,"Kapanewon Banguntapan, Bantul, DI Yogyakarta, Indonesia",Kurang dari setahun,N/A,https://glints.com/id/opportunities/jobs/staff-pajak/74595c8b-ca71-4f3d-b56e-df3c2d6e3aba?utm_referrer=explore
Math Teacher(Remote),HIGGZ ACADEMIA TECHNOLOGY PTE. LTD.,"Rungkut, Surabaya, Jawa Timur, Indonesia",Minimal SMA/SMK,N/A,https://glints.com/id/opportunities/jobs/math-teacherremote/a3c39694-c81a-4665-8298-b97c246fa410?utm_referrer=explore
Editor Video Series Drama,PT. TREASURE SHIP INDONESIA,"Penjaringan, Jakarta Utara, DKI Jakarta, Indonesia",Eyelash Extensions,N/A,https://glints.com/id/opportunities/jobs/editor-video-series-drama/a809917a-d702-43f0-9772-b0945e0afcdb?utm_referrer=explore
Sales Mobil Honda,PT. Parama Sutera Autotren,"Pinang, Tangerang, Banten, Indonesia",+2,N/A,https://glints.com/id/opportunities/jobs/sales-mobil-honda/34a0cd70-c21c-4d93-8999-3f5b4bb8e3ff?utm_referrer=explore
Freelance Operations [Balikpapan],PT Paragon Pratama Teknologi (StickEarn),"Balikpapan Selatan, Balikpapan, Kalimantan Timur, Indonesia",Kontrak,N/A,https://glints.com/id/opportunities/jobs/freelance-operations-balikpapan/b84005a4-f78d-4235-a18b-a37bd08218ee?utm_referrer=explore
HRD Internship,PT Pick Arpu Technology,"Penjaringan, Jakarta Utara, DKI Jakarta, Indonesia",3 – 5 tahun,N/A,https://glints.com/id/opportunities/jobs/hrd-internship/3d2e9ef2-31c1-4ff9-8490-96f1fd3be1ed?utm_referrer=explore
Content Creator,Hivenley,"Kapanewon Pajangan, Bantul, DI Yogyakarta, Indonesia",Minimal Diploma (D1 - D4),N/A,https://glints.com/id/opportunities/jobs/content-creator/82f6008e-e829-49f7-b0a6-4b664ceea247?utm_referrer=explore
Credit Marketing Officer,PT Manu ,"Duren Sawit, Jakarta Timur, DKI Jakarta, Indonesia",Food Hygiene,N/A,https://glints.com/id/opportunities/jobs/credit-marketing-officer/5413e14e-4293-4ca9-869f-1989b7916529?utm_referrer=explore
Shopkeeper,Secaca.id,"Puri, Mojokerto, Jawa Timur, Indonesia",Catering Service,N/A,https://glints.com/id/opportunities/jobs/shopkeeper/3ff21a14-d270-4682-a8be-d51ebc374eb3?utm_referrer=explore
Shopkeeper,Secaca.id,"Puri, Mojokerto, Jawa Timur, Indonesia",+2,N/A,https://glints.com/id/opportunities/jobs/shopkeeper/3a56c207-6060-4795-8525-e985842de612?utm_referrer=explore
Shopkeeper,Secaca.id,"Puri, Mojokerto, Jawa Timur, Indonesia",Penuh Waktu,N/A,https://glints.com/id/opportunities/jobs/shopkeeper/dd4b3bde-8e93-47d4-b93a-4963b8ddfae1?utm_referrer=explore
Teknik Elektromedik (Atem),Omnifit,"Cakung, Jakarta Timur, DKI Jakarta, Indonesia",1 – 3 tahun,N/A,https://glints.com/id/opportunities/jobs/teknik-elektromedik-atem/0c6d0f5c-1b1f-4ee0-ac07-28cb102b54e4?utm_referrer=explore
Mobile Waiter,Brillant Autocare,"Rungkut, Surabaya, Jawa Timur, Indonesia",Minimal Sarjana (S1),N/A,https://glints.com/id/opportunities/jobs/mobile-waiter/ef820ba2-0db9-4b98-b374-ffc7c6aeadfc?utm_referrer=explore
Admin Sales Optimize Kaca,PT. JATILUHUR INDOGLASS MANDIRI,"Pademangan, Jakarta Utara, DKI Jakarta, Indonesia",Odoo Developer,N/A,https://glints.com/id/opportunities/jobs/admin-sales-optimize-kaca/9b4793d2-0c2c-4b6d-ae49-70add540e9c5?utm_referrer=explore
Design Engineer,PT Sentratek Adiprestasi,"Sawah Besar, Jakarta Pusat, DKI Jakarta, Indonesia",Penuh Waktu,"Rp2,5jt-Rp2,5jt",https://glints.com/id/opportunities/jobs/design-engineer/226c3a0f-6382-490a-9a32-9525c6880de2?utm_referrer=explore
Web Developer Intern,Alan Creative,"Cimanggis, Depok, Jawa Barat, Indonesia",Kurang dari setahun,"Rp2,5jt-Rp2,5jt",https://glints.com/id/opportunities/jobs/web-developer-intern/3ba316c0-b88b-4b89-b130-58874f99687f?utm_referrer=explore
Learning Operation Intern,Arkademi,"Cilandak, Jakarta Selatan, DKI Jakarta, Indonesia",Minimal Sarjana (S1),"Rp2,5jt-Rp2,5jt",https://glints.com/id/opportunities/jobs/learning-operation-intern/3e2b6753-c267-474b-9923-e4d7474b364e?utm_referrer=explore
Beauty Advisor (Pekanbaru),PT NRI Global Mandiri (Nature Republic Indonesia),"Pekanbaru Kota, Pekanbaru, Riau, Indonesia",Teknik Sipil,"Rp2,5jt-Rp2,5jt",https://glints.com/id/opportunities/jobs/beauty-advisor-pekanbaru/fed88383-9aad-4264-b594-90f197cd8c36?utm_referrer=explore
Host Live & Content Creator,DIGIWORKS,"Antapani, Bandung, Jawa Barat, Indonesia",CAD,"Rp1,5jt-Rp4,5jt",https://glints.com/id/opportunities/jobs/host-live-and-content-creator/e7da5f4a-9c92-404e-a3b9-b16eb4efe158?utm_referrer=explore
SECURITY,PT. Nur Elang Persada,"Tuban, Tuban, Jawa Timur, Indonesia",+2,Rp2jt-Rp3jt,https://glints.com/id/opportunities/jobs/security/fb374a44-fbf3-4eb5-9be0-8f37c7633a80?utm_referrer=explore
SECURITY,PT. Nur Elang Persada,"Gresik, Gresik, Jawa Timur, Indonesia",Magang,N/A,https://glints.com/id/opportunities/jobs/security/793c18c3-da4e-47b4-95bd-20a344c6aedd?utm_referrer=explore
SECURITY,PT. Nur Elang Persada,"Mojosari, Mojokerto, Jawa Timur, Indonesia",Kurang dari setahun,N/A,https://glints.com/id/opportunities/jobs/security/2e48e6af-1839-495f-91ba-fe79cdc36762?utm_referrer=explore
SECURITY,PT. Nur Elang Persada,"Wonocolo, Surabaya, Jawa Timur, Indonesia",Minimal SMA/SMK,N/A,https://glints.com/id/opportunities/jobs/security/76620b4e-799f-4ea5-8816-26fa70c5d40b?utm_referrer=explore
Cleaning Service,PT Karya Usaha Baru,"Leces, Probolinggo, Jawa Timur, Indonesia",Mvc Frameworks,N/A,https://glints.com/id/opportunities/jobs/cleaning-service/02ef2607-c41d-4d20-a5c6-ed9349d9bc6e?utm_referrer=explore
REVISI,PT Karya Usaha Baru,"Kebomas, Gresik, Jawa Timur, Indonesia",SQL/NoSQL,N/A,https://glints.com/id/opportunities/jobs/revisi/88474195-1323-4efb-b48f-e6a062b05629?utm_referrer=explore
PACKING,PT Karya Usaha Baru,"Kebomas, Gresik, Jawa Timur, Indonesia",+11,N/A,https://glints.com/id/opportunities/jobs/packing/8665509c-2a43-436e-9e32-5e040714c461?utm_referrer=explore
Cost Control Management Staff,WOM Finance Mega Glodok Kemayoran ,"Tanjung Priok, Jakarta Utara, DKI Jakarta, Indonesia",Magang,N/A,https://glints.com/id/opportunities/jobs/cost-control-management-staff/031f5a91-a5f0-4acc-8b75-e78fbbbe3d1b?utm_referrer=explore
FORKLIFT,PT Karya Usaha Baru,"Kebomas, Gresik, Jawa Timur, Indonesia",Kurang dari setahun,N/A,https://glints.com/id/opportunities/jobs/forklift/3503b835-cc18-4e89-9b8b-50339b7fb422?utm_referrer=explore
GRADDING,PT Karya Usaha Baru,"Kebomas, Gresik, Jawa Timur, Indonesia",Minimal Sarjana (S1),N/A,https://glints.com/id/opportunities/jobs/gradding/880a1c3a-1932-4f8a-bbcc-368ee8762114?utm_referrer=explore
MOULDING,PT Karya Usaha Baru,"Kebomas, Gresik, Jawa Timur, Indonesia",Good Communication Skills,N/A,https://glints.com/id/opportunities/jobs/moulding/fd00a15a-7843-43fd-8e4b-02d6d1c4e9c7?utm_referrer=explore
Supervisor Sales,Yamaha Meji Sakti Motor,"Tambaksari, Surabaya, Jawa Timur, Indonesia",+3,N/A,https://glints.com/id/opportunities/jobs/supervisor-sales/20548386-b7b9-4c2d-a99a-56bde1dbe749?utm_referrer=explore
CROSSCUT,PT Karya Usaha Baru,"Kebomas, Gresik, Jawa Timur, Indonesia",Kontrak,N/A,https://glints.com/id/opportunities/jobs/crosscut/565b7b69-1819-4464-a847-06baa9080b91?utm_referrer=explore
Creative Designer (Internship),PT Homeco Victoria Makmur,"Penjaringan, Jakarta Utara, DKI Jakarta, Indonesia",Kurang dari setahun,N/A,https://glints.com/id/opportunities/jobs/creative-designer-internship/55ddaf24-53ab-4f6d-8f41-479f1c490f21?utm_referrer=explore
Drone Pilot Spraying (Kalimantan),PT Terra Drone Indonesia,"Sebulu, Kutai Kartanegara, Kalimantan Timur, Indonesia",Minimal SMA/SMK,N/A,https://glints.com/id/opportunities/jobs/drone-pilot-spraying-kalimantan/04d9d8f5-e710-49c0-8f1f-dcbdf9a05fdc?utm_referrer=explore
Garden (DW),Kashantee Village,"Kuta, Badung, Bali, Indonesia",Beauty Advisor,N/A,https://glints.com/id/opportunities/jobs/garden-dw/4ddbceff-7b11-4cef-92f4-91489618fca4?utm_referrer=explore
Waitress (DW),Kashantee Village,"Kuta, Badung, Bali, Indonesia",Cosmetics & Beauty,N/A,https://glints.com/id/opportunities/jobs/waitress-dw/7f7718cb-5c48-4c43-aa14-6004b19c03a6?utm_referrer=explore
Sales Engineer,PT Fujitec Indonesia,"Kembangan, Jakarta Barat, DKI Jakarta, Indonesia",+14,N/A,https://glints.com/id/opportunities/jobs/sales-engineer/96385f49-7e30-43e6-a62c-1d41897e28d6?utm_referrer=explore
Data Engineer,Pt. Quantus Telematika Indonesia,"Coblong, Bandung, Jawa Barat, Indonesia",Penuh Waktu,N/A,https://glints.com/id/opportunities/jobs/data-engineer/0c0e594f-1d27-405b-9559-abd85a906607?utm_referrer=explore
Sales Service,PT Fujitec Indonesia,"Kebon Jeruk, Jakarta Barat, DKI Jakarta, Indonesia",Kurang dari setahun,N/A,https://glints.com/id/opportunities/jobs/sales-service/b03e3464-bf38-4bc9-9239-cc7088f5d920?utm_referrer=explore
Front Office Intern,Synergy Pro Business Consulting,"Kuta, Badung, Bali, Indonesia",Minimal SMA/SMK,N/A,https://glints.com/id/opportunities/jobs/front-office-intern/11996f2a-193f-4b2e-80ca-e059c133f0b2?utm_referrer=explore
QUALITY MANAGEMENT SYSTEM (MAGANG),"Pt Diagnos Laboratorium Utama, Tbk","Menteng, Jakarta Pusat, DKI Jakarta, Indonesia",Aktif Dan Inisiatif,N/A,https://glints.com/id/opportunities/jobs/quality-management-system-magang/01f3cfe0-b66b-4421-ac83-c9b138cf2e87?utm_referrer=explore
Asisten Dokter Gigi,Orthosmile Dental Care Clinic,"Kelapa Gading, Jakarta Utara, DKI Jakarta, Indonesia",+2,N/A,https://glints.com/id/opportunities/jobs/asisten-dokter-gigi/1f44f653-65a1-48b1-8c20-33eebc080fe9?utm_referrer=explore
Frontend Developer Intern,Seeds Finance,"Tanah Abang, Jakarta Pusat, DKI Jakarta, Indonesia",Penuh Waktu,N/A,https://glints.com/id/opportunities/jobs/frontend-developer-intern/d7484d26-dedf-4f05-bcf0-1c67da25db8e?utm_referrer=explore
Crew - Part Time,Dímsām,"Penjaringan, Jakarta Utara, DKI Jakarta, Indonesia",Kurang dari setahun,N/A,https://glints.com/id/opportunities/jobs/crew-part-time/312220d1-51c2-4034-a5b7-68bc12a80929?utm_referrer=explore
Crew - Full Time,Dímsām,"Penjaringan, Jakarta Utara, DKI Jakarta, Indonesia",Penuh Waktu,"Rp1,6jt-Rp2,5jt",https://glints.com/id/opportunities/jobs/crew-full-time/3807db00-464f-488e-a957-f6e2d97b34b7?utm_referrer=explore
Ecommerce Trainee (Mandarin Speaker),PT. Selalu Sukses Prima,"Serpong Utara, Tangerang Selatan, Banten, Indonesia",Kurang dari setahun,"Rp3,5jt-Rp4jt",https://glints.com/id/opportunities/jobs/ecommerce-trainee-mandarin-speaker/2ab45d9c-5fb1-4bfc-87c4-b93cc0e11004?utm_referrer=explore
Host Live Streaming,GIO CARDIN,"Bojongloa Kidul, Bandung, Jawa Barat, Indonesia",Minimal SMA/SMK,Rp1jt,https://glints.com/id/opportunities/jobs/host-live-streaming/30a641aa-c685-4d30-acaa-c4e24ca6dd60?utm_referrer=explore
Business Development Executive Intern,Seeds Finance,"Tanah Abang, Jakarta Pusat, DKI Jakarta, Indonesia",Bisa bekerja dalam team,"Rp2,1jt-Rp3jt",https://glints.com/id/opportunities/jobs/business-development-executive-intern/2ab6b980-42c1-40c6-a63a-8534c3ca5c8c?utm_referrer=explore
Sales Showroom,PT Smoot Motor Indonesia,"Kebon Jeruk, Jakarta Barat, DKI Jakarta, Indonesia",+2,Rp500rb-Rp1jt,https://glints.com/id/opportunities/jobs/sales-showroom/580ff7e2-1d89-467b-bdb5-25895bbad661?utm_referrer=explore
SPG dan SPB,PT Smoot Motor Indonesia,"Kebon Jeruk, Jakarta Barat, DKI Jakarta, Indonesia",Penuh Waktu,"Rp3jt-Rp3,5jt",https://glints.com/id/opportunities/jobs/spg-dan-spb/2d552b15-bc42-4c42-9662-a502e973fb03?utm_referrer=explore
Sales Consultant,BMW Astra Surabaya,"Suko Manunggal, Surabaya, Jawa Timur, Indonesia",Kurang dari setahun,Rp500rb-Rp1jt,https://glints.com/id/opportunities/jobs/sales-consultant/e9e76e63-2939-4504-be93-659edc0b9c0b?utm_referrer=explore
Spa Therapist,GRAND MIRAGE BALI,"Kuta Selatan, Badung, Bali, Indonesia",Minimal Sarjana (S1),N/A,https://glints.com/id/opportunities/jobs/spa-therapist/a6258035-74a8-4e89-9a9e-774a00b20119?utm_referrer=explore
Photo Editor - Night Shift Yogyakarta,Mindreach Consulting,"Kapanewon Mlati, Sleman, DI Yogyakarta, Indonesia",Fluent In Mandarin,N/A,https://glints.com/id/opportunities/jobs/photo-editor-night-shift-yogyakarta/000bf5c1-7bcd-4a32-b4a4-180bcc9656a1?utm_referrer=explore
Social Media Design,GEA BABY,"Benda, Tangerang, Banten, Indonesia",+2,N/A,https://glints.com/id/opportunities/jobs/social-media-design/8124f55f-e018-4364-aa1c-010b01a337c8?utm_referrer=explore
Host Live Streaming,PT. BINTANG SEMESTA CAKRAWALA,"Penjaringan, Jakarta Utara, DKI Jakarta, Indonesia",Kontrak,N/A,https://glints.com/id/opportunities/jobs/host-live-streaming/f05899c0-2583-4608-a29f-9516f9a6c31a?utm_referrer=explore
Magang IT,PT. Kobe Boga Utama,"Curug, Tangerang, Banten, Indonesia",Kurang dari setahun,N/A,https://glints.com/id/opportunities/jobs/magang-it/01d9c058-efa9-4d6b-8739-7aaa9b7b703c?utm_referrer=explore
Housekeeping (Trainee),Baleka Resort Bali,"Kuta, Badung, Bali, Indonesia",Minimal SMA/SMK,N/A,https://glints.com/id/opportunities/jobs/housekeeping-trainee/b4ca7687-fb80-4a3e-9f7d-760bf4b9b00b?utm_referrer=explore
Front Office (Trainee),Baleka Resort Bali,"Kuta, Badung, Bali, Indonesia",Hosting Skills,N/A,https://glints.com/id/opportunities/jobs/front-office-trainee/0f1018b3-cad4-4907-9d81-4a86d1258eba?utm_referrer=explore
BARISTA SERVICE CREW,Maison Feerie,"Tangerang, Tangerang, Banten, Indonesia",Good In Selling Skill,N/A,https://glints.com/id/opportunities/jobs/barista-service-crew/22dfebc7-2048-4ca1-80da-96df596788fe?utm_referrer=explore
Content Creator,iMoji Service,"Gubeng, Surabaya, Jawa Timur, Indonesia",+1,N/A,https://glints.com/id/opportunities/jobs/content-creator/efd1562f-813a-4064-83a8-59586258759a?utm_referrer=explore
Public Relations Intern,Compas.co.id,"Tanah Abang, Jakarta Pusat, DKI Jakarta, Indonesia",Magang,N/A,https://glints.com/id/opportunities/jobs/public-relations-intern/11c1807c-f749-44a1-83e8-b5b8218a1b9b?utm_referrer=explore
Sales Canvasser,PT Danamas Insan Kreasi Andalan (Jawa Timur),"Dungkek, Sumenep, Jawa Timur, Indonesia",Kurang dari setahun,N/A,https://glints.com/id/opportunities/jobs/sales-canvasser/3fc737cd-d44d-42f0-bd8c-b9076b7e863e?utm_referrer=explore
Marketing Communication Paid On-Site Internship,Nava Sinergi Lab,"Kapanewon Depok, Sleman, DI Yogyakarta, Indonesia",Minimal Diploma (D1 - D4),N/A,https://glints.com/id/opportunities/jobs/marketing-communication-paid-on-site-internship/662a66f6-6ad4-4868-886b-521f3c382c33?utm_referrer=explore
Intern Gudang,PT Onesia Nusantara Evolusi,"Cipondoh, Tangerang, Banten, Indonesia",Business Analyst,N/A,https://glints.com/id/opportunities/jobs/intern-gudang/208c8240-08ef-41a1-99a6-8adfff19f210?utm_referrer=explore
Operational Crew,PT. SUN Digital Teknologi Indonesia,"Dukuh Pakis, Surabaya, Jawa Timur, Indonesia",+2,N/A,https://glints.com/id/opportunities/jobs/operational-crew/71cfb841-34d1-4832-b73d-ab788d4f78ac?utm_referrer=explore
Technical Writer Intern,Mostrans Global Digilog,"Cempaka Putih, Jakarta Pusat, DKI Jakarta, Indonesia",Kontrak,N/A,https://glints.com/id/opportunities/jobs/technical-writer-intern/64119dfb-81df-4ab8-a1f3-c6abbde9859f?utm_referrer=explore
Sosial Media Specialist,PT Aventama Hervent Solusindo,"Lengkong, Bandung, Jawa Barat, Indonesia",Kurang dari setahun,N/A,https://glints.com/id/opportunities/jobs/sosial-media-specialist/94257e2c-6c12-472b-91d2-e1003f3cbeca?utm_referrer=explore
Talent Freelance,PT Kuaikuai Tech Indonesia (Pinjam Yuk),"Grogol Petamburan, Jakarta Barat, DKI Jakarta, Indonesia",Minimal SMA/SMK,N/A,https://glints.com/id/opportunities/jobs/talent-freelance/91363cc9-2243-4de2-98af-8c6144e7dd78?utm_referrer=explore
Kurir Shopee Express,Finfleet,"Wiyung, Surabaya, Jawa Timur, Indonesia",Sales Marketing,N/A,https://glints.com/id/opportunities/jobs/kurir-shopee-express/fec85a34-14f7-455f-97e0-5580e00db6b4?utm_referrer=explore
Promotor (Bekasi),PT Arkana Advance Technology (Bang Jamin),"Setiabudi, Jakarta Selatan, DKI Jakarta, Indonesia",+2,N/A,https://glints.com/id/opportunities/jobs/promotor-bekasi/187c8501-e83c-4a1e-8833-c7729d538e20?utm_referrer=explore
Promotor (Tangerang),PT Arkana Advance Technology (Bang Jamin),"Setiabudi, Jakarta Selatan, DKI Jakarta, Indonesia",Kontrak,N/A,https://glints.com/id/opportunities/jobs/promotor-tangerang/edb73ce5-fa96-4daf-9556-d87f684b86f8?utm_referrer=explore
Promotor (Depok),PT Arkana Advance Technology (Bang Jamin),"Setiabudi, Jakarta Selatan, DKI Jakarta, Indonesia",Kurang dari setahun,N/A,https://glints.com/id/opportunities/jobs/promotor-depok/f427e9ad-1038-4c20-a3c5-5856a3178e5e?utm_referrer=explore
Promotor (Bogor),PT Arkana Advance Technology (Bang Jamin),"Setiabudi, Jakarta Selatan, DKI Jakarta, Indonesia",Minimal SMA/SMK,N/A,https://glints.com/id/opportunities/jobs/promotor-bogor/233b361b-931a-4b8e-b5f2-55a686a11a4d?utm_referrer=explore
Customer Service,PT Bahtera Pesat Lintasbuana,"Balikpapan Timur, Balikpapan, Kalimantan Timur, Indonesia",SPG,N/A,https://glints.com/id/opportunities/jobs/customer-service/d3b413f0-1505-4868-a9e3-e19d082973d7?utm_referrer=explore
Social Media Internship,CatNClaw,"Kebayoran Lama, Jakarta Selatan, DKI Jakarta, Indonesia",Magang,"Rp1,5jt",https://glints.com/id/opportunities/jobs/social-media-internship/3e7f1553-b2a1-4936-9e15-d8e576857073?utm_referrer=explore
Staff Accounting,PT Karya Usaha Baru,"Gempol, Pasuruan, Jawa Timur, Indonesia",Kurang dari setahun,"Rp3,5jt-Rp6,5jt",https://glints.com/id/opportunities/jobs/staff-accounting/0c8fc13c-1e6f-417f-9d13-9be1208deef4?utm_referrer=explore
Packing,PT Karya Usaha Baru,"Sidoarjo, Sidoarjo, Jawa Timur, Indonesia",Minimal Diploma (D1 - D4),Rp3jt-Rp6jt,https://glints.com/id/opportunities/jobs/packing/3c462f3e-68de-4c5c-9b48-a27b4cd8dbeb?utm_referrer=explore
Driver,PT Karya Usaha Baru,"Sidoarjo, Sidoarjo, Jawa Timur, Indonesia",Content Creation,"Rp4,1jt-Rp5,5jt",https://glints.com/id/opportunities/jobs/driver/bf9347f8-6995-4714-a23e-29919e0fef4d?utm_referrer=explore
Tally,PT Karya Usaha Baru,"Sidoarjo, Sidoarjo, Jawa Timur, Indonesia",+2,Rp600rb-Rp1jt,https://glints.com/id/opportunities/jobs/tally/c692866a-2d81-4097-a6af-00aa444ae32d?utm_referrer=explore
JURU MASAK,PT Karya Usaha Baru,"Leces, Probolinggo, Jawa Timur, Indonesia",Penuh Waktu,Rp600rb-Rp1jt,https://glints.com/id/opportunities/jobs/juru-masak/baf26f96-5adb-4b87-841d-bfb1229f8061?utm_referrer=explore
IT Production Support & Quality Assurance Internship,SwipeRx,"Tanah Abang, Jakarta Pusat, DKI Jakarta, Indonesia",Kurang dari setahun,Rp600rb-Rp1jt,https://glints.com/id/opportunities/jobs/it-production-support-and-quality-assurance-internship/29cca88a-1ada-417a-bdba-d444628716e6?utm_referrer=explore
Freelance Game Content Creator,Yummy Yummy Tummy Inc,"Grogol Petamburan, Jakarta Barat, DKI Jakarta, Indonesia",Minimal Sarjana (S1),Rp600rb-Rp1jt,https://glints.com/id/opportunities/jobs/freelance-game-content-creator/694fa451-59e9-4377-90ed-bf9751e7f723?utm_referrer=explore
Mitra Desk Collection Semarang,PT. Ewaysindo Makmur (Wgroup ID),"Pedurungan, Semarang, Jawa Tengah, Indonesia",Berpengalaman,Rp600rb-Rp1jt,https://glints.com/id/opportunities/jobs/mitra-desk-collection-semarang/dc31c92f-7d31-4335-a2d8-2d1148159604?utm_referrer=explore
Posisi Bidang Akuntansi & Keuangan Lainnya,VW AUDI ALL ROAD,"Ciputat, Tangerang Selatan, Banten, Indonesia",Ms Office,N/A,https://glints.com/id/opportunities/jobs/posisi-bidang-akuntansi-and-keuangan-lainnya/02647ddf-c0e8-40e7-ab35-8295e1d47f8b?utm_referrer=explore
Graphic Designer (Paid Internship),Pnd Ice Making System,"Gambir, Jakarta Pusat, DKI Jakarta, Indonesia",+5,N/A,https://glints.com/id/opportunities/jobs/graphic-designer-paid-internship/b6762346-339d-4b86-b51e-34eef49e3410?utm_referrer=explore
Guru Bimbel,Kahar Kids Club,"Cipondoh, Tangerang, Banten, Indonesia",Penuh Waktu,N/A,https://glints.com/id/opportunities/jobs/guru-bimbel/cc78473e-3b86-44e6-9e41-e53314de02eb?utm_referrer=explore
Tentor Sejarah,Delta Bimbel,"Puri, Mojokerto, Jawa Timur, Indonesia",Kurang dari setahun,N/A,https://glints.com/id/opportunities/jobs/tentor-sejarah/cc254c70-fca7-4291-bd62-9e9d8e6a5620?utm_referrer=explore
Tentor Bahasa Inggris,Delta Bimbel,"Puri, Mojokerto, Jawa Timur, Indonesia",Minimal SMA/SMK,N/A,https://glints.com/id/opportunities/jobs/tentor-bahasa-inggris/660ff2e8-c7e9-4712-985d-5dedd4550b6c?utm_referrer=explore
Tentor Matematika,Delta Bimbel,"Puri, Mojokerto, Jawa Timur, Indonesia",Rajin Bertanggung Jawab,N/A,https://glints.com/id/opportunities/jobs/tentor-matematika/caf369e7-6b95-42ce-9a3c-99c4ca408bcc?utm_referrer=explore
English Coach / Teacher,PT. Sumber Ilmu Pengetahuan,"Tambun Selatan, Bekasi, Jawa Barat, Indonesia",+4,N/A,https://glints.com/id/opportunities/jobs/english-coach-teacher/81da06b0-2d2f-43e0-9079-72f8739cf9b6?utm_referrer=explore
Tentor PKN,Delta Bimbel,"Puri, Mojokerto, Jawa Timur, Indonesia",Penuh Waktu,N/A,https://glints.com/id/opportunities/jobs/tentor-pkn/9059cdd3-3e83-47bd-9246-c50492881882?utm_referrer=explore
Tentor Tes Karakteristik Pribadi,Delta Bimbel,"Puri, Mojokerto, Jawa Timur, Indonesia",Kurang dari setahun,N/A,https://glints.com/id/opportunities/jobs/tentor-tes-karakteristik-pribadi/76ac33bf-6d5f-4e5a-bc97-30cd10629a51?utm_referrer=explore
Crew/Helpher,Mama Noor,"Wonokromo, Surabaya, Jawa Timur, Indonesia",Minimal SMA/SMK,N/A,https://glints.com/id/opportunities/jobs/crew-helpher/65008dab-73b0-4165-9110-11bb4dc76270?utm_referrer=explore
Cashier,Mama Noor,"Wonokromo, Surabaya, Jawa Timur, Indonesia",Driver,N/A,https://glints.com/id/opportunities/jobs/cashier/70eff338-6bd0-4f07-acb0-cfdfdd319f43?utm_referrer=explore
finance consultan,PT Valbury Asia Futures,"Kapanewon Mlati, Sleman, DI Yogyakarta, Indonesia",Memiliki Sim A,N/A,https://glints.com/id/opportunities/jobs/finance-consultan/def65bc3-f0e8-4dbf-a18b-f4346c65e0f6?utm_referrer=explore
IT Product Specialist,Pt Doxadigital Indonesia,"Kalideres, Jakarta Barat, DKI Jakarta, Indonesia",+5,N/A,https://glints.com/id/opportunities/jobs/it-product-specialist/a592044e-ab20-4e0b-8779-bd55f8f1ad67?utm_referrer=explore
Graphic Designer Intern,Faith Fade,"Cengkareng, Jakarta Barat, DKI Jakarta, Indonesia",Penuh Waktu,N/A,https://glints.com/id/opportunities/jobs/graphic-designer-intern/bd0807b8-a74d-46c7-abe9-392895fd0156?utm_referrer=explore
