Job Title,Company,Location,Work Type,Salary,Link
Mitra Desk Collection Semarang,PT. Ewaysindo Makmur (Wgroup ID),"Pedurungan, Semarang, Jawa Tengah, Indonesia",Penuh Waktu,N/A,https://glints.com/id/opportunities/jobs/mitra-desk-collection-semarang/dc31c92f-7d31-4335-a2d8-2d1148159604?utm_referrer=explore
Junior Transfer Pricing,SF Consulting,"Setiabudi, Jakarta Selatan, DKI Jakarta, Indonesia",Kurang dari setahun,N/A,https://glints.com/id/opportunities/jobs/junior-transfer-pricing/222077c2-52d8-4c50-b259-ca3acbbfe12e?utm_referrer=explore
Host Live Streamer,Redwoodsdigital,"Serpong Utara, Tangerang Selatan, Banten, Indonesia",Minimal Sarjana (S1),N/A,https://glints.com/id/opportunities/jobs/host-live-streamer/1b9de4bc-0c85-4a6b-bd31-a797a927e92f?utm_referrer=explore
Marketing Executive,Tunas Toyota Pecenongan ,"Gambir, Jakarta Pusat, DKI Jakarta, Indonesia",Finance Accounting,N/A,https://glints.com/id/opportunities/jobs/marketing-executive/3a7715a5-4f4b-479d-91cd-ce10a4daa115?utm_referrer=explore
Graphic Designer,Cera Production,"Kapanewon Depok, Kab. Sleman, DI Yogyakarta, Indonesia",+3,N/A,https://glints.com/id/opportunities/jobs/graphic-designer/4efda602-e152-4f87-842c-fe680df93083?utm_referrer=explore
Project Development,PT. Ayo Jadi Pengusaha ( SPSO.ID ),"Cipondoh, Tangerang, Banten, Indonesia",Penuh Waktu,"Rp4,3jt-Rp7,2jt",https://glints.com/id/opportunities/jobs/project-development/2d4e0bb4-52ca-43b0-9c9b-e3b3cba3d0f0?utm_referrer=explore
Aktuaris Internship,KB Insurance Indonesia,"Tanah Abang, Jakarta Pusat, DKI Jakarta, Indonesia",Kurang dari setahun,"Rp2,5jt-Rp3jt",https://glints.com/id/opportunities/jobs/aktuaris-internship/89ac5086-9dc4-41f5-8fca-32a18d0091cc?utm_referrer=explore
Field Sales Coordinator - Chili,Jiva,"Muntilan, Kab. Magelang, Jawa Tengah, Indonesia",Minimal Sarjana (S1),"Rp2,3jt-Rp10jt",https://glints.com/id/opportunities/jobs/field-sales-coordinator-chili/4b846188-5761-48fd-9934-9ffc02a2f861?utm_referrer=explore
Field Sales Coordinator,Jiva,"Medan Kota, Medan, Sumatera Utara, Indonesia",Konseptor,"Rp3,5jt-Rp4,8jt",https://glints.com/id/opportunities/jobs/field-sales-coordinator/ebf5f601-2072-4ba2-a9fa-d97256f8c553?utm_referrer=explore
BRANCH RELATIONSHIP OFFICER,PT. Mandiri Andalan Utama Surabaya,"Kertak Hanyar, Kab. Banjar, Kalimantan Selatan, Indonesia",Event Organizer,"Rp2,5jt-Rp50jt",https://glints.com/id/opportunities/jobs/branch-relationship-officer/ec323122-2649-4ea3-8245-0ed7fb5ffe1b?utm_referrer=explore
Sales Executive,Lancar Jaya Abadi,"Sidoarjo, Kab. Sidoarjo, Jawa Timur, Indonesia",+1,"Rp2,5jt-Rp3jt",https://glints.com/id/opportunities/jobs/sales-executive/4376596d-8881-45ea-af2e-26816cdf2662?utm_referrer=explore
Personal Assistant,MindSeat Official,"Kuta Selatan, Kab. Badung, Bali, Indonesia",Penuh Waktu,Rp3jt-Rp6jt,https://glints.com/id/opportunities/jobs/personal-assistant/17615671-1d6b-4e6f-9be5-a61f7719922c?utm_referrer=explore
Sales Otomotif,Chery Arta Pluit,"Penjaringan, Jakarta Utara, DKI Jakarta, Indonesia",Kurang dari setahun,Rp2jt-Rp6jt,https://glints.com/id/opportunities/jobs/sales-otomotif/1e3b6482-bc4b-4439-a185-93b88c2077bd?utm_referrer=explore
Staff Account Payable,PT. Andalan Fluid Sistem,"Bogor Utara, Bogor, Jawa Barat, Indonesia",Minimal Diploma (D1 - D4),"Rp4jt-Rp5,7jt",https://glints.com/id/opportunities/jobs/staff-account-payable/e93c48d8-3f1a-4371-a720-17cec66b5abc?utm_referrer=explore
Programming,DB Klik,"Rungkut, Surabaya, Jawa Timur, Indonesia",Microsoft Excel,"Rp2,5jt-Rp2,6jt",https://glints.com/id/opportunities/jobs/programming/14c33dd2-6879-46f9-b294-b3b2e9364200?utm_referrer=explore
Host & Hostes,Asana Artseum Bali,"Kuta Selatan, Kab. Badung, Bali, Indonesia",+2,Rp25jt-Rp33jt,https://glints.com/id/opportunities/jobs/host-and-hostes/9bafd758-5cd8-4bad-8ef3-fdf718f92bf8?utm_referrer=explore
Creative Intern,Batik Wolter,"Kembangan, Jakarta Barat, DKI Jakarta, Indonesia",Penuh Waktu,"Rp2,5jt-Rp3,3jt",https://glints.com/id/opportunities/jobs/creative-intern/ec208d3d-f253-4c39-87ae-a1d4e3b68f81?utm_referrer=explore
GRAPHIC DESIGNER,PT ERA SINERGI SATULANGIT,"Pondok Melati, Bekasi, Jawa Barat, Indonesia",Kurang dari setahun,"Rp2,8jt-Rp3jt",https://glints.com/id/opportunities/jobs/graphic-designer/941efd1f-4c2c-460a-90a8-ca5b6e5d95c9?utm_referrer=explore
Interior Design (Fulltime),Kozystay,"Kebayoran Baru, Jakarta Selatan, DKI Jakarta, Indonesia",Minimal SMA/SMK,N/A,https://glints.com/id/opportunities/jobs/interior-design-fulltime/22f65dfd-bada-4b96-bd92-692c260e1345?utm_referrer=explore
Supervisor Store,JAENS SPA,"Gianyar, Kab. Gianyar, Bali, Indonesia",Pertanian,N/A,https://glints.com/id/opportunities/jobs/supervisor-store/2b4abfac-5fc1-48a2-a74d-d6856cb58b70?utm_referrer=explore
Sales Promotor Printer,Activate Asia Group,"Kemantren Tegalrejo, Yogyakarta, DI Yogyakarta, Indonesia",Berkomunikasi Dengan Baik,N/A,https://glints.com/id/opportunities/jobs/sales-promotor-printer/4a9067e1-411a-4a26-915f-cb610bff8c8a?utm_referrer=explore
Admin Streaming,X45 Management,"Cipondoh, Tangerang, Banten, Indonesia",+1,N/A,https://glints.com/id/opportunities/jobs/admin-streaming/4abae3bb-eabd-4098-90e4-f05da2bb6986?utm_referrer=explore
Admin Marketing,GALAXY DIGITAL BALI,"Denpasar Barat, Denpasar, Bali, Indonesia",Penuh Waktu,N/A,https://glints.com/id/opportunities/jobs/admin-marketing/4564f3d2-e1e6-4e0a-bd70-2489acd86dab?utm_referrer=explore
Beauty Advisor,PT Social Bella Indonesia,"Kembangan, Jakarta Barat, DKI Jakarta, Indonesia",Kurang dari setahun,N/A,https://glints.com/id/opportunities/jobs/beauty-advisor/05f5de0b-4498-47ff-b400-38c32130e3fc?utm_referrer=explore
JUNIOR SALES ENGINEER,Pt Graha Esa,"Kelapa Gading, Jakarta Utara, DKI Jakarta, Indonesia",Minimal SMA/SMK,N/A,https://glints.com/id/opportunities/jobs/junior-sales-engineer/0ad264ec-a658-4ceb-a11b-351a33a8553c?utm_referrer=explore
Community Manager,PT TANAH AIR RAYA,"Pabean Cantikan, Surabaya, Jawa Timur, Indonesia",Pertanian,N/A,https://glints.com/id/opportunities/jobs/community-manager/95cb57fa-aef4-46ee-98e3-8b7aad97e437?utm_referrer=explore
Marketing Wilayah Samarinda,PT Raja Cepat Nusantara,"Kesambi, Cirebon, Jawa Barat, Indonesia",Memiliki Kemampuan Komunikasi Yang Baik,N/A,https://glints.com/id/opportunities/jobs/marketing-wilayah-samarinda/0b0ece40-9105-4955-bcd7-6f6a99760ae9?utm_referrer=explore
Butcher,PT BALI PAWIWAHAN (Coco Group) ,"Kuta Selatan, Kab. Badung, Bali, Indonesia",+1,N/A,https://glints.com/id/opportunities/jobs/butcher/ed6c86fc-04e3-4348-b099-df115d981230?utm_referrer=explore
Pramuniaga,PT BALI PAWIWAHAN (Coco Group) ,"Denpasar Barat, Denpasar, Bali, Indonesia",Penuh Waktu,N/A,https://glints.com/id/opportunities/jobs/pramuniaga/6f864e29-a922-4a73-ba6f-88d9f613391a?utm_referrer=explore
Direktur Sales Regional,Pt. Rhino Indonesia Sukses,"Sawah Besar, Jakarta Pusat, DKI Jakarta, Indonesia",Kurang dari setahun,N/A,https://glints.com/id/opportunities/jobs/direktur-sales-regional/6b36182e-ae4b-4127-b388-654641d3ae97?utm_referrer=explore
Staff Sensei,parentoday,"Sukoharjo, Kab. Sukoharjo, Jawa Tengah, Indonesia",Minimal SMA/SMK,N/A,https://glints.com/id/opportunities/jobs/staff-sensei/613eb526-851a-4660-ac7d-6dc832dd85ad?utm_referrer=explore
INTERNSHIP COMMUNICATION,PT. Multi Kontrol Nusantara,"Setiabudi, Jakarta Selatan, DKI Jakarta, Indonesia",Marketing,N/A,https://glints.com/id/opportunities/jobs/internship-communication/3a590d38-5b54-45f1-8ddd-580f83201750?utm_referrer=explore
Production Cake Daily Worker,Kibo Cheese,"Pondok Aren, Tangerang Selatan, Banten, Indonesia",Kemampuan Negosiasi,N/A,https://glints.com/id/opportunities/jobs/production-cake-daily-worker/b0540abf-e063-4d7b-8423-9ccf146f3782?utm_referrer=explore
Sales Executive,PT Minuman Bahagia Pemersatu Nusantara,"Dukuh Pakis, Surabaya, Jawa Timur, Indonesia",+1,N/A,https://glints.com/id/opportunities/jobs/sales-executive/2e298f18-6545-40df-b203-e91ec58e5cca?utm_referrer=explore
Accounting Officer,CV RAJAWALI CELLULAR,"Denpasar Timur, Denpasar, Bali, Indonesia",Penuh Waktu,N/A,https://glints.com/id/opportunities/jobs/accounting-officer/4f4c70f2-0dfb-490b-9afa-aef5c5661ca2?utm_referrer=explore
JUNIOR 3D ARTIST,Sveindonesia,"Kapanewon Ngemplak, Kab. Sleman, DI Yogyakarta, Indonesia",Penuh Waktu,"Rp3,5jt-Rp6,5jt",https://glints.com/id/opportunities/jobs/junior-3d-artist/cd4a11b2-4770-4dbd-9a71-b3691725f9ff?utm_referrer=explore
Intern Video Editor,Samara Media & Entertainment,"Kebayoran Baru, Jakarta Selatan, DKI Jakarta, Indonesia",Kurang dari setahun,Rp2jt-Rp3jt,https://glints.com/id/opportunities/jobs/intern-video-editor/be49cc8d-c7e3-4e32-99ab-a7bead22e1f5?utm_referrer=explore
Marketing Officer Branch Balikpapan,Pt.  Asuransi Raksa Pratikara,"Balikpapan Selatan, Balikpapan, Kalimantan Timur, Indonesia",Minimal Sarjana (S1),Rp6jt-Rp9jt,https://glints.com/id/opportunities/jobs/marketing-officer-branch-balikpapan/e399a241-e664-4099-93df-55c1f977ed86?utm_referrer=explore
Retention and Winback,MyRepublic Bali,"Denpasar Barat, Denpasar, Bali, Indonesia",3D Modeling,"Rp2,6jt-Rp2,7jt",https://glints.com/id/opportunities/jobs/retention-and-winback/c1b1207f-6e5d-4108-9de0-3109d7cd062e?utm_referrer=explore
Staff Laboratorium Hospitality,Matana University,"Kelapa Dua, Kab. Tangerang, Banten, Indonesia",Blender 3d,"Rp5,2jt-Rp6,5jt",https://glints.com/id/opportunities/jobs/staff-laboratorium-hospitality/44d05793-d1d9-4eb9-857d-acc6af36cd8e?utm_referrer=explore
Dosen Bahasa Jepang,Politeknik Takumi,"Cikarang Selatan, Kab. Bekasi, Jawa Barat, Indonesia",+1,"Rp4,5jt-Rp5,5jt",https://glints.com/id/opportunities/jobs/dosen-bahasa-jepang/90d9bb10-03ef-437b-a036-75e8d38b47e5?utm_referrer=explore
Admin GUDANG SPAREPART HP,Pusat Service Macbook Bali,"Denpasar Timur, Denpasar, Bali, Indonesia",Penuh Waktu,"USD1,1rb-USD1,4rb",https://glints.com/id/opportunities/jobs/admin-gudang-sparepart-hp/3fdb5577-76ff-4835-9a05-9aaeae470401?utm_referrer=explore
Sales Showroom,PT Panca Wisesa Adhika,"Gambir, Jakarta Pusat, DKI Jakarta, Indonesia",Kurang dari setahun,Rp2jt-Rp5jt,https://glints.com/id/opportunities/jobs/sales-showroom/4bb18ef1-8ad7-4f10-a194-0b36f9f2bd7d?utm_referrer=explore
QUALITY MANAGEMENT SYSTEM (MAGANG),"Pt Diagnos Laboratorium Utama, Tbk","Menteng, Jakarta Pusat, DKI Jakarta, Indonesia",Minimal Sarjana (S1),"Rp3,5jt-Rp4,3jt",https://glints.com/id/opportunities/jobs/quality-management-system-magang/01f3cfe0-b66b-4421-ac83-c9b138cf2e87?utm_referrer=explore
Pengajar Bahasa Jepang,LPK MINORI,"Cikarang Selatan, Kab. Bekasi, Jawa Barat, Indonesia",Video Editing,Rp2jt-Rp5jt,https://glints.com/id/opportunities/jobs/pengajar-bahasa-jepang/6122f822-f3ae-43a9-a6c3-56e10dbf1d8b?utm_referrer=explore
Customer Service - Fraud Support,Kiriminaja,"Kapanewon Ngaglik, Kab. Sleman, DI Yogyakarta, Indonesia",Videography,Rp25jt-Rp30jt,https://glints.com/id/opportunities/jobs/customer-service-fraud-support/0b43903b-71c9-4be2-9ac9-f56f9d92781d?utm_referrer=explore
Analyst,Pt Cognos Cendekia Global,"Pal Merah, Jakarta Barat, DKI Jakarta, Indonesia",+1,N/A,https://glints.com/id/opportunities/jobs/analyst/14cee420-b49c-496a-81c1-76de8bd81acc?utm_referrer=explore
Account Executive,Pt. Growell Natural Indonesia,"Penjaringan, Jakarta Utara, DKI Jakarta, Indonesia",Penuh Waktu,N/A,https://glints.com/id/opportunities/jobs/account-executive/c31f35d7-dcd5-4269-aa07-c673c2327f46?utm_referrer=explore
Staff Operasional,PT Kharisma Sinergi Sukses,"Sooko, Kab. Mojokerto, Jawa Timur, Indonesia",Kurang dari setahun,N/A,https://glints.com/id/opportunities/jobs/staff-operasional/8143d87c-2b32-4b7c-a3bb-56d026d29be4?utm_referrer=explore
Guru PAUD,Rumah Quran Al Mujaahiddah,"Bekasi Utara, Bekasi, Jawa Barat, Indonesia",Minimal Sarjana (S1),N/A,https://glints.com/id/opportunities/jobs/guru-paud/fdd9bbe1-85ad-4e5e-bab3-c25b46c8df82?utm_referrer=explore
Guru TPQ,Rumah Quran Al Mujaahiddah,"Bekasi Utara, Bekasi, Jawa Barat, Indonesia",Memiliki Kemampuan Komunikasi Yang Baik,N/A,https://glints.com/id/opportunities/jobs/guru-tpq/a8241d09-b27d-428e-91bc-c6e2a5d83e63?utm_referrer=explore
Shop Drawing Staff,PT Jaya Obayashi,"Pancoran, Jakarta Selatan, DKI Jakarta, Indonesia",+2,N/A,https://glints.com/id/opportunities/jobs/shop-drawing-staff/3dcfc06f-a957-425d-ae7a-ee96315a4b5a?utm_referrer=explore
IT Controls Engineer (T3 Soekarno-Hatta Airport),PT. DEXTER WIKA SINERGI,"Benda, Tangerang, Banten, Indonesia",Harian,N/A,https://glints.com/id/opportunities/jobs/it-controls-engineer-t3-soekarno-hatta-airport/7ec8cff9-607c-476f-ab33-fefc2557f5f9?utm_referrer=explore
Account Executive 会计助理,OTT InfoTech,"Nongsa, Batam, Kepulauan Riau, Indonesia",Kurang dari setahun,N/A,https://glints.com/id/opportunities/jobs/account-executive-会计助理/09587705-697e-4fad-9db2-cd35c11464ae?utm_referrer=explore
Lowongan Personal Assistant,Abadi Mandiri Furniture,"Kelapa Dua, Kab. Tangerang, Banten, Indonesia",Minimal SMA/SMK,N/A,https://glints.com/id/opportunities/jobs/lowongan-personal-assistant/2027633d-3f7b-4fbc-ae49-af78deeccd32?utm_referrer=explore
Sales Executive,Hyundai Arista Pluit,"Penjaringan, Jakarta Utara, DKI Jakarta, Indonesia",Memiliki SIM C,N/A,https://glints.com/id/opportunities/jobs/sales-executive/3a87ddea-9c80-4bda-8ada-3955f3d83f3a?utm_referrer=explore
Kitchen Crew,Oishi Sushi Restaurant,"Serpong Utara, Tangerang Selatan, Banten, Indonesia",Bersepeda motor,N/A,https://glints.com/id/opportunities/jobs/kitchen-crew/759f44bb-abf7-4a3b-92f6-8b3360647f61?utm_referrer=explore
Cook Helper,Oishi Sushi Restaurant,"Serpong Utara, Tangerang Selatan, Banten, Indonesia",+1,N/A,https://glints.com/id/opportunities/jobs/cook-helper/23c73a3f-7653-49f8-a260-1f58a216b856?utm_referrer=explore
Host Live Streaming,Pt Seraphim Karya Agung,"Penjaringan, Jakarta Utara, DKI Jakarta, Indonesia",Penuh Waktu,N/A,https://glints.com/id/opportunities/jobs/host-live-streaming/a08f8762-35cf-4647-944e-278114bb38b6?utm_referrer=explore
Kasir,Oishi Sushi Restaurant,"Serpong Utara, Tangerang Selatan, Banten, Indonesia",Kurang dari setahun,N/A,https://glints.com/id/opportunities/jobs/kasir/6aa6bb27-a07b-4b2d-ac6a-a7c55ceb487c?utm_referrer=explore
HSE Officer,Rumah Prefab by PT BNP,"Sekongkang, Kab. Sumbawa Barat, Nusa Tenggara Barat, Indonesia",Minimal Sarjana (S1),N/A,https://glints.com/id/opportunities/jobs/hse-officer/ad3f0104-933b-4f5b-bec1-7f22415ffff9?utm_referrer=explore
Admin Sales Konsultant,PT Cyber Futures Jakarta,"Kebayoran Baru, Jakarta Selatan, DKI Jakarta, Indonesia",Pastry Chef/baker,N/A,https://glints.com/id/opportunities/jobs/admin-sales-konsultant/bb3cb018-4e91-4f15-8604-c7077ef4cbd5?utm_referrer=explore
Project Manager Salesforce,PT. Orang Informasi Teknologi,"Kebayoran Baru, Jakarta Selatan, DKI Jakarta, Indonesia",+3,N/A,https://glints.com/id/opportunities/jobs/project-manager-salesforce/2f558ac3-2c8b-4373-8eba-a9a640cc8f70?utm_referrer=explore
Digital Marketing,PT. Integritas Perkasa Konstruksi,"Cengkareng, Jakarta Barat, DKI Jakarta, Indonesia",Penuh Waktu,N/A,https://glints.com/id/opportunities/jobs/digital-marketing/a4841ac2-862d-4f9f-bfda-faa917104c34?utm_referrer=explore
IT System Administrator,PT Fan Integrasi Teknologi,"Setiabudi, Jakarta Selatan, DKI Jakarta, Indonesia",Kurang dari setahun,N/A,https://glints.com/id/opportunities/jobs/it-system-administrator/2f14d0fb-ef26-419d-9778-6b05a8b1682f?utm_referrer=explore
Product Manager,PT Bangun Inovasi Teknologi,"Denpasar Timur, Denpasar, Bali, Indonesia",Penuh Waktu,Rp3jt-Rp8jt,https://glints.com/id/opportunities/jobs/product-manager/c88a70f7-abcd-4efd-b77b-3d1404c7214d?utm_referrer=explore
Management Trainee Batch 2,PT Green Energi Utama,"Singosari, Kab. Malang, Jawa Timur, Indonesia",Kurang dari setahun,"Rp4,5jt-Rp7jt",https://glints.com/id/opportunities/jobs/management-trainee-batch-2/0db1a416-a42c-4991-9cb7-efdaafa56805?utm_referrer=explore
Host Live & Content Creator,DIGIWORKS,"Antapani, Bandung, Jawa Barat, Indonesia",Minimal Diploma (D1 - D4),"Rp1,5jt-Rp3jt",https://glints.com/id/opportunities/jobs/host-live-and-content-creator/e7da5f4a-9c92-404e-a3b9-b16eb4efe158?utm_referrer=explore
Model Beginner,Mutiara Laut Essential,"Cengkareng, Jakarta Barat, DKI Jakarta, Indonesia",Strategi Bisnis,Rp4jt-Rp7jt,https://glints.com/id/opportunities/jobs/model-beginner/bc74360c-14eb-4e19-be8b-fcb2d72dbffb?utm_referrer=explore
Beauty Advisor BSD,PT NRI Global Mandiri (Nature Republic Indonesia),"Serpong Utara, Tangerang Selatan, Banten, Indonesia",+2,"Rp2,6jt-Rp2,8jt",https://glints.com/id/opportunities/jobs/beauty-advisor-bsd/92bf5318-1d32-418d-9be9-8b73e6394a30?utm_referrer=explore
Penanggung Jawab Teknis,PT.Golden Hitech Indonesia,"Cipondoh, Tangerang, Banten, Indonesia",Penuh Waktu,"Rp2,9jt-Rp29jt",https://glints.com/id/opportunities/jobs/penanggung-jawab-teknis/545c0bc8-6071-4dfb-8bb4-fb64bbbe0b70?utm_referrer=explore
Host Live Streaming,GIO CARDIN,"Bojongloa Kidul, Bandung, Jawa Barat, Indonesia",Kurang dari setahun,"Rp2jt-Rp2,5jt",https://glints.com/id/opportunities/jobs/host-live-streaming/30a641aa-c685-4d30-acaa-c4e24ca6dd60?utm_referrer=explore
Japanese-Speaking Account Executive,PT Netmarks Indonesia,"Pademangan, Jakarta Utara, DKI Jakarta, Indonesia",Minimal Sarjana (S1),"Rp3jt-Rp4,5jt",https://glints.com/id/opportunities/jobs/japanese-speaking-account-executive/ffa97673-e0f8-405c-98ea-9ca948a35c08?utm_referrer=explore
Kepala Sekolah,Mr. BOB Kampung Inggris,"Kebon Sari, Kab. Madiun, Jawa Timur, Indonesia",Public Speaking,"Rp2jt-Rp2,5jt",https://glints.com/id/opportunities/jobs/kepala-sekolah/9db4055d-9550-475c-b2bd-87a74c8407c5?utm_referrer=explore
Desk Collection,PT. Tritunggal Buana Sejahtera,"Pagedangan, Kab. Tangerang, Banten, Indonesia",+3,"Rp1,5jt-Rp6jt",https://glints.com/id/opportunities/jobs/desk-collection/d050b376-ee98-4ca1-86e1-54928d6840dc?utm_referrer=explore
Consumer Loan Marketing,PT Valdo INC Bekasi,"Pondok Gede, Bekasi, Jawa Barat, Indonesia",Penuh Waktu,"Rp2,5jt-Rp3,5jt",https://glints.com/id/opportunities/jobs/consumer-loan-marketing/1c6c6d31-f8c8-4614-9cbc-94fbe816ce72?utm_referrer=explore
Sales Engineer,PT Chemitra Abadi,"Pinang, Tangerang, Banten, Indonesia",Kurang dari setahun,"USD1rb-USD1,4rb",https://glints.com/id/opportunities/jobs/sales-engineer/9625471e-6c56-4323-91bd-e844e4fc83d9?utm_referrer=explore
ACCOUNT OFFICER DEVELOPMENT PROGRAM,Pt Bprs Al Salaam Amal Salman,"Bogor Utara, Bogor, Jawa Barat, Indonesia",Minimal SMA/SMK,"USD1rb-USD1,4rb",https://glints.com/id/opportunities/jobs/account-officer-development-program/1ee2c675-a99f-4476-9997-34ac144ac930?utm_referrer=explore
LOWONGAN PENGEMUDI TAXI BLUEBIRD,Bluebird Pool Peta Selatan,"Kalideres, Jakarta Barat, DKI Jakarta, Indonesia",Komunikatif,N/A,https://glints.com/id/opportunities/jobs/lowongan-pengemudi-taxi-bluebird/ec63087b-a83c-4577-8a18-a46f8e166222?utm_referrer=explore
Sales Canvas,Sumber Nelayan Indonesia,"Rancaekek, Kab. Bandung, Jawa Barat, Indonesia",Berpenampilan Menarik,N/A,https://glints.com/id/opportunities/jobs/sales-canvas/e5ccddbe-3b6f-47d2-804c-f4bf8c7702cb?utm_referrer=explore
Account Manager,Gtech Group,"Tanah Abang, Jakarta Pusat, DKI Jakarta, Indonesia",+1,N/A,https://glints.com/id/opportunities/jobs/account-manager/ccef0543-799c-4c9c-9a58-02bfa7298a03?utm_referrer=explore
Collection Officer,PT.SINAR JERNIH SUKSESINDO,"Peterongan, Kab. Jombang, Jawa Timur, Indonesia",Penuh Waktu,N/A,https://glints.com/id/opportunities/jobs/collection-officer/c3a5bef2-17f1-473b-9d22-8c71c9deacd5?utm_referrer=explore
Freelance Photographer & Videographer,Kala Memoto,"Kebayoran Lama, Jakarta Selatan, DKI Jakarta, Indonesia",Kurang dari setahun,N/A,https://glints.com/id/opportunities/jobs/freelance-photographer-and-videographer/5b2132fe-a5d8-4300-a419-84a318dc04c3?utm_referrer=explore
Admin Penagihan,KSP Graha Arthamas,"Lakarsantri, Surabaya, Jawa Timur, Indonesia",Minimal SMA/SMK,N/A,https://glints.com/id/opportunities/jobs/admin-penagihan/02056765-40f8-4213-84da-fc1656b2891e?utm_referrer=explore
Accounting Internship,PT Multi Guna Maritim,"Kembangan, Jakarta Barat, DKI Jakarta, Indonesia",Good Loking,N/A,https://glints.com/id/opportunities/jobs/accounting-internship/11fc6515-4884-4f77-bd8e-57b0307d00f8?utm_referrer=explore
Teknisi Alat Kesehatan,PT. MULTIMEDILAB KARYAMANDIRI,"Bandung Kidul, Bandung, Jawa Barat, Indonesia",Public Speaking Skills,N/A,https://glints.com/id/opportunities/jobs/teknisi-alat-kesehatan/be29bfa3-5d80-4b3f-ba22-b61d3520643c?utm_referrer=explore
DevOps Intern,Seeds Finance,"Tanah Abang, Jakarta Pusat, DKI Jakarta, Indonesia",+5,N/A,https://glints.com/id/opportunities/jobs/devops-intern/c209303c-340f-480d-9df3-4279b3e52cf4?utm_referrer=explore
Sales Executive,Lancar Jaya Abadi,"Gresik, Kab. Gresik, Jawa Timur, Indonesia",Penuh Waktu,N/A,https://glints.com/id/opportunities/jobs/sales-executive/e9ecf560-5144-49bb-a72b-4fff0e613ff6?utm_referrer=explore
Instructional Designer (Remote),PT. Mega Harapan Mulia (Kelas.com),"Grogol Petamburan, Jakarta Barat, DKI Jakarta, Indonesia",Kurang dari setahun,N/A,https://glints.com/id/opportunities/jobs/instructional-designer-remote/3a674071-64b8-4b43-b3f7-7989e9407960?utm_referrer=explore
Sales Counter,PT BEVOS AUTO MANDIRI,"Denpasar Barat, Denpasar, Bali, Indonesia",Minimal SMA/SMK,N/A,https://glints.com/id/opportunities/jobs/sales-counter/af2d45ba-8acc-4fb4-8034-43b544ba9fcf?utm_referrer=explore
Account Executive,MyRepublic Jawa Timur,"Madiun, Kab. Madiun, Jawa Timur, Indonesia",Passionate about Beauty,N/A,https://glints.com/id/opportunities/jobs/account-executive/6981af17-1a1f-4dae-adc6-9528d1fe5fb4?utm_referrer=explore
Business Development Officer - Tanggerang,PT Cilia Prisma Utama Makmur,"Tangerang, Tangerang, Banten, Indonesia",+9,N/A,https://glints.com/id/opportunities/jobs/business-development-officer-tanggerang/dacfc349-e43c-4f7d-8dd5-ee9a2bd0cfb5?utm_referrer=explore
Admin Sosial Media dan Konten Kreator,Ray White Bintaro Trade Center,"Pondok Aren, Tangerang Selatan, Banten, Indonesia",Penuh Waktu,N/A,https://glints.com/id/opportunities/jobs/admin-sosial-media-dan-konten-kreator/ea1956f0-1cf4-4659-ada6-a9afafa0bd39?utm_referrer=explore
Account Executive 会计助理,OTT InfoTech,"Medan Area, Medan, Sumatera Utara, Indonesia",Kurang dari setahun,N/A,https://glints.com/id/opportunities/jobs/account-executive-会计助理/0ea1b2e7-6389-45ac-818e-259499d276ee?utm_referrer=explore
Account Executive 会计助理,OTT InfoTech,"Makasar, Jakarta Timur, DKI Jakarta, Indonesia",Minimal Sarjana (S1),N/A,https://glints.com/id/opportunities/jobs/account-executive-会计助理/4b79898c-a733-43de-b5d1-e10512e733c2?utm_referrer=explore
Crew Store,Shake Shake In A Tub Bali,"Denpasar Timur, Denpasar, Bali, Indonesia",Penuh Waktu,"Rp3,5jt-Rp5jt",https://glints.com/id/opportunities/jobs/crew-store/14b5d765-42fc-4c44-9bd4-b248823355e0?utm_referrer=explore
Compliance Intern,Jack,"Pancoran, Jakarta Selatan, DKI Jakarta, Indonesia",Kurang dari setahun,"Rp4,5jt-Rp6jt",https://glints.com/id/opportunities/jobs/compliance-intern/7b86c608-a3e9-4c5f-ba96-811423d59be5?utm_referrer=explore
Kordinator Sarpras,Dafi Pesantren Al-Quran Science Sidoarjo,"Sukodono, Sidoarjo, Jawa Timur, Indonesia",Minimal SMA/SMK,"Rp4,5jt-Rp5,5jt",https://glints.com/id/opportunities/jobs/kordinator-sarpras/4f523b3f-b482-4d3a-9d76-fc820a25a929?utm_referrer=explore
Guru BK,Dafi Pesantren Al-Quran Science Sidoarjo,"Sukodono, Sidoarjo, Jawa Timur, Indonesia",Berpenampilan Rapi,N/A,https://glints.com/id/opportunities/jobs/guru-bk/9df1eb50-c1fc-4651-bd91-60af5ecb111d?utm_referrer=explore
Musyrif,Dafi Pesantren Al-Quran Science Sidoarjo,"Sukodono, Sidoarjo, Jawa Timur, Indonesia",+2,N/A,https://glints.com/id/opportunities/jobs/musyrif/37c2615f-6ec5-4a57-b0f2-35b9e5bd623a?utm_referrer=explore
Talent Host Livestreamer,Ditusi Gaming,"Kelapa Dua, Tangerang, Banten, Indonesia",Magang,N/A,https://glints.com/id/opportunities/jobs/talent-host-livestreamer/54058d17-5ebc-4e9b-b3c0-27f5345b3c95?utm_referrer=explore
Sales Jawa Tengah,Orang Tua Group,"Gajah Mungkur, Semarang, Jawa Tengah, Indonesia",Kurang dari setahun,N/A,https://glints.com/id/opportunities/jobs/sales-jawa-tengah/c822a9c3-8cc2-405e-a1cf-317fe5eff432?utm_referrer=explore
Teknisi,PT Airia Semesta,"Suko Manunggal, Surabaya, Jawa Timur, Indonesia",Minimal SMA/SMK,N/A,https://glints.com/id/opportunities/jobs/teknisi/43e51ed8-9b5d-4ca1-94c7-01800f0e4267?utm_referrer=explore
Sales Jawa Barat Utara,Orang Tua Group,"Pekalipan, Cirebon, Jawa Barat, Indonesia",KYC,N/A,https://glints.com/id/opportunities/jobs/sales-jawa-barat-utara/26fc258f-6d61-4a10-ade6-12acb9c2ce36?utm_referrer=explore
NAIL THERAPIST,NB Studio Bekasi,"Bekasi Utara, Bekasi, Jawa Barat, Indonesia",Transaction Monitoring,N/A,https://glints.com/id/opportunities/jobs/nail-therapist/9eee8b91-ed00-4aa2-9b04-8bdcb97bf191?utm_referrer=explore
CHINESE TEACHER,Central Mandarin,"Dukuh Pakis, Surabaya, Jawa Timur, Indonesia",+1,N/A,https://glints.com/id/opportunities/jobs/chinese-teacher/0cd9b206-3a07-48a0-bd1c-843f9481d068?utm_referrer=explore
Juru Masak,Bakso Benhil (Cabang Setiabudi),"Mampang Prapatan, Jakarta Selatan, DKI Jakarta, Indonesia",Penuh Waktu,N/A,https://glints.com/id/opportunities/jobs/juru-masak/d9ea4d58-6f7b-4761-ab47-b2767ab3d75e?utm_referrer=explore
Bartender,The Blue Door,"Ubud, Gianyar, Bali, Indonesia",Kurang dari setahun,N/A,https://glints.com/id/opportunities/jobs/bartender/12353acd-11ec-40a4-ad82-3ec1a985a262?utm_referrer=explore
Staff Hostes,The Blue Door,"Ubud, Gianyar, Bali, Indonesia",Minimal Diploma (D1 - D4),N/A,https://glints.com/id/opportunities/jobs/staff-hostes/c4f8792b-6df7-45ce-8b19-41d66bc85438?utm_referrer=explore
E-Commerce Operations Staff,Ditusi Gaming,"Kelapa Dua, Tangerang, Banten, Indonesia",Musyrifah,N/A,https://glints.com/id/opportunities/jobs/e-commerce-operations-staff/5d2d60ae-5cff-4815-8769-04d2c9c5c2ec?utm_referrer=explore
